{
  "$schema": "../../../machine/schemas/uix9b-live-proof-plan.v2.schema.json",
  "schema_version": "uix9b.live-proof-plan.v2",
  "role": "UIX_9B_V2_LIVE_PROOF_PLAN",
  "canonical_sha": "bf6f14316fa8814eeac91440c4a7d70be0d04b9e",
  "fixture_digest": "280f1361eda45c2b632c37dd049ec47dec81ab1e8e9e81c61a7aa0d9fb96b978",
  "task_digest": "3708f0d7d172a424ed426a6275d5012df6a11b0718ed37cba95ba0724c0c506d",
  "validator_digest": "285494688ef105c813ef5f449f1e13b75529c8cddbf8a42ea76d283a9d5eecf3",
  "uix_guidance_digest": "f989ac579875fbcd349f812fa6e241ba5c8505f9f940abcb5e0e30006f1606ab",
  "evaluator_version": "uix9b-live-metric-evaluator-v2.0.0",
  "evaluator_digest": "d585010eb83ec23b1df2c3512868e9ff5285e7dced1393dcafb0233b835f7ae1",
  "calibration_manifest": "machine/ui/uix9b-live-calibration-manifest.v2.json",
  "provider_preparation": {"provider": "openai-codex", "model": "gpt-5.6-luna", "model_revision": "UNRESOLVED_PENDING_LIVE_AUTHORIZATION", "reasoning_effort": "xhigh", "codex_cli_version": "codex-cli 0.148.0", "host_os": "Windows-11-10.0.26200-SP0", "host_architecture": "AMD64"},
  "task": {"path": "tests/fixtures/ui/uix9-live-project/task.md", "digest": "3708f0d7d172a424ed426a6275d5012df6a11b0718ed37cba95ba0724c0c506d", "question": "Does adding canonical Orchestra UIX-1 through UIX-8 guidance materially improve objective UI implementation fidelity when provider, model, task, starting project, permitted dependencies, resource ceiling, validator, acceptance requirements, and retry policy remain the same?", "model_self_rating": false, "subjective_visual_score": false},
  "arms": [
    {"arm_id": "BASELINE_NO_ORCHESTRA_UIX_GUIDANCE", "guidance_treatment": "NO_ORCHESTRA_UIX_GUIDANCE", "fixture_digest": "280f1361eda45c2b632c37dd049ec47dec81ab1e8e9e81c61a7aa0d9fb96b978", "task_digest": "3708f0d7d172a424ed426a6275d5012df6a11b0718ed37cba95ba0724c0c506d", "validator_digest": "285494688ef105c813ef5f449f1e13b75529c8cddbf8a42ea76d283a9d5eecf3", "uix_guidance_digest_or_NONE": "NONE", "only_intended_treatment_difference": true},
    {"arm_id": "GOVERNED_CANONICAL_UIX_1_8_GUIDANCE", "guidance_treatment": "CANONICAL_UIX_1_8_GUIDANCE", "fixture_digest": "280f1361eda45c2b632c37dd049ec47dec81ab1e8e9e81c61a7aa0d9fb96b978", "task_digest": "3708f0d7d172a424ed426a6275d5012df6a11b0718ed37cba95ba0724c0c506d", "validator_digest": "285494688ef105c813ef5f449f1e13b75529c8cddbf8a42ea76d283a9d5eecf3", "uix_guidance_digest_or_NONE": "f989ac579875fbcd349f812fa6e241ba5c8505f9f940abcb5e0e30006f1606ab", "only_intended_treatment_difference": true}
  ],
  "repetitions_per_arm": 3,
  "total_valid_executions": 6,
  "execution_order": ["A1", "B1", "B2", "A2", "A3", "B3"],
  "primary_metric_directions": {"COMPONENT_REUSE": "true_is_better", "DUPLICATE_COMPONENT_COUNT": "lower_is_better", "TOKEN_VIOLATIONS": "lower_is_better", "ARBITRARY_STYLE_DRIFT": "lower_is_better", "STATE_COVERAGE": "higher_is_better", "ASSET_PROVENANCE": "true_is_better", "ASSET_SUBSTITUTION": "false_is_better", "RESPONSIVE_CONTAINMENT": "true_is_better", "ACCESSIBILITY_INVARIANTS": "true_is_better", "UNRESOLVED_MAPPINGS": "lower_is_better", "REVISION_MISMATCH": "false_is_better", "VISUAL_BASELINE_REPLACEMENT": "false_is_better", "DETERMINISTIC_ACCEPTANCE": "true_is_better"},
  "provider_accounting": {"historical_counters": {"experimental_model_calls": 6, "experimental_provider_calls": 6, "nonexperimental_availability_probes": 1, "total_provider_interactions": 7, "invalid_infrastructure_retries": 0}, "new_campaign_authorization_counters": {"experimental_model_calls": 0, "experimental_provider_calls": 0, "nonexperimental_availability_probes": 0, "total_provider_interactions": 0, "invalid_infrastructure_retries": 0}, "immutable_limits": {"experimental_model_calls": 6, "experimental_provider_calls": 6, "nonexperimental_availability_probes": 1, "total_provider_interactions": 7, "invalid_infrastructure_retries": 1}},
  "resource_ceiling_proposal": {"max_model_calls_per_run": 1, "max_total_model_calls": 6, "max_experimental_provider_calls": 6, "max_nonexperimental_availability_probes": 1, "max_total_provider_interactions": 7, "token_or_compute_ceiling": "MAX_TOTAL_TOKENS_120000_MAX_PER_RUN_20000", "per_run_timeout_seconds": 900, "total_campaign_timeout_seconds": 7200, "max_retries_for_invalid_infrastructure_run": 1, "max_external_repo_mutations": 0},
  "retry_policy": {"valid_unfavorable_output": "KEEP_RESULT_NO_RETRY_FOR_OUTCOME", "provider_outage": "CLASSIFY_EXPLICITLY_REPLACEMENT_ONLY_UNDER_FROZEN_OUTAGE_POLICY", "host_crash": "CLASSIFY_INVALID_INFRASTRUCTURE_RUN_REPLACEMENT_ALLOWED", "resource_ceiling_exceeded": "STOP_RUN_PRESERVE_EVIDENCE_DO_NOT_EXTEND_LIMIT", "protocol_breach": "FAIL_CLOSED_APPLY_FROZEN_INVALIDATION_POLICY"},
  "result_classification_rules": {"allowed": ["BENEFIT_ESTABLISHED", "NO_BENEFIT_ESTABLISHED", "MIXED_OR_INCONCLUSIVE", "PROTOCOL_INVALID"], "benefit_established": ["NO_GOVERNED_HARD_GUARDRAIL_REGRESSION", "GOVERNED_DETERMINISTIC_ACCEPTANCE_EQUAL_OR_BETTER", "MULTIPLE_STRUCTURAL_METRICS_IMPROVE_ACROSS_MAJORITY_OF_PAIRS", "NOT_SINGLE_METRIC_DEPENDENT", "ALL_COUNTED_RUNS_VALID"], "no_benefit_established": "Valid evidence does not establish a repeatable governed advantage; do not infer that Orchestra makes UI worse.", "mixed_or_inconclusive": ["MATERIAL_METRIC_REGRESSION_OR_CONFLICT", "REPETITION_CONFLICT", "INSUFFICIENT_DIRECTIONAL_EVIDENCE"], "protocol_invalid": "Frozen controls or evidence integrity cannot be preserved.", "no_single_metric_decides": true},
  "external_mutation_boundary": {"external_repo_mutations": 0, "protected_systems": ["Orderly", "Padayon", "Registry", "production infrastructure", "production services", "installed integrations", "release tags", "GitHub Releases", "canonical main directly"], "production_secrets_or_customer_data": false, "deployment": false, "policy_activation": false},
  "evidence_contract": {"observation_schema": "machine/schemas/uix9b-live-proof-observation.v2.schema.json", "metric_result_schema": "machine/schemas/uix9b-live-metric-result.v2.schema.json", "result_schema": "machine/schemas/uix9b-live-proof-result.v2.schema.json", "retention_paths": ["docs/validation/UIX_9B_CODEX_LIVE_CALL_AUTHORIZATION_REQUEST.md", "docs/validation/uix9b-live-evidence-v2/", "tests/fixtures/ui/uix9-live-project/"], "screenshots_primary_scoring": false, "model_self_rating_included": false},
  "authority": {"live_model_calls_authorized": false, "provider_calls_authorized": false, "uix9c_execution_authorized": false, "max_new_live_calls": 0, "benefit_claim": "NONE", "harm_claim": "NONE", "directional_model_behavior_claim": "NONE"}
}
